{"benchmark_suites":[],"capabilities":[{"capability_id":"policy.long-session-loop","version":"1.0.0"},{"capability_id":"prime.long-session-continuity","version":"1.0.0"}],"conformance":[],"package_id":"prime-long-session-continuity-native","protocol":"asterion.capability-package/v1","resources":[],"version":"1.0.0"}
