{"benchmark_suites":[],"capabilities":[{"capability_id":"dci.analysis","version":"1.0.0"},{"capability_id":"dci.benchmark","version":"1.0.0"},{"capability_id":"dci.evaluation","version":"1.0.0"},{"capability_id":"dci.export","version":"1.0.0"},{"capability_id":"dci.research","version":"1.0.0"},{"capability_id":"policy.local-corpus","version":"1.0.0"},{"capability_id":"protocol.observability","version":"1.0.0"}],"conformance":[{"media_type":"application/json","resource_id":"externalization.json","sha256":"4b35f7b25c6c9fb5af313f839f3f5db57ee4c55c22d83a122b4d076b38aa2f97"}],"package_id":"dci","protocol":"asterion.capability-package/v1","resources":[{"media_type":"application/json","resource_id":"dci-local-package.json","sha256":"ca2577771003e3cdd2e6171d8e6f173f82cd07084f01ce88dd3425f6b7bf90be"}],"version":"1.0.0"}
