{"benchmark_suites":[{"suite_id":"dci.all","version":"1.0.0"},{"suite_id":"dci.bcplus.level3","version":"1.0.0"},{"suite_id":"dci.bcplus.main","version":"1.0.0"},{"suite_id":"dci.beir.arguana","version":"1.0.0"},{"suite_id":"dci.beir.scifact","version":"1.0.0"},{"suite_id":"dci.bright.biology","version":"1.0.0"},{"suite_id":"dci.bright.earth-science","version":"1.0.0"},{"suite_id":"dci.bright.economics","version":"1.0.0"},{"suite_id":"dci.bright.robotics","version":"1.0.0"},{"suite_id":"dci.github","version":"1.0.0"},{"suite_id":"dci.paper-main","version":"1.0.0"},{"suite_id":"dci.qa.2wikimultihopqa","version":"1.0.0"},{"suite_id":"dci.qa.bamboogle.github-sample50","version":"1.0.0"},{"suite_id":"dci.qa.bamboogle.paper-full125","version":"1.0.0"},{"suite_id":"dci.qa.hotpotqa","version":"1.0.0"},{"suite_id":"dci.qa.musique","version":"1.0.0"},{"suite_id":"dci.qa.nq","version":"1.0.0"},{"suite_id":"dci.qa.triviaqa","version":"1.0.0"}],"capabilities":[{"capability_id":"dci.analysis","version":"1.0.0"},{"capability_id":"dci.benchmark","version":"1.0.0"},{"capability_id":"dci.evaluation","version":"1.0.0"},{"capability_id":"dci.export","version":"1.0.0"},{"capability_id":"dci.research","version":"1.0.0"},{"capability_id":"policy.context-management","version":"1.0.0"},{"capability_id":"policy.local-corpus","version":"1.0.0"},{"capability_id":"protocol.observability","version":"1.0.0"}],"conformance":[{"media_type":"application/json","resource_id":"externalization.json","sha256":"ef325a5abc773497cebf044eb8f0c05e117c4b0ee461e711160a13fcb3409f43"}],"package_id":"dci","protocol":"asterion.capability-package/v1","resources":[{"media_type":"application/json","resource_id":"dci-package.json","sha256":"10a387ed7b25e99092d4ba532862dad48f0e7e1502f21341a374aaa6d4643496"}],"version":"1.0.0"}
