{
  "protocol": "asterion.capability-package/v1",
  "package_id": "controlled-code",
  "version": "1.0.0",
  "capabilities": [
    {"capability_id": "evaluation.code-quality", "version": "1.0.0"},
    {"capability_id": "observability.execution-audit", "version": "1.0.0"},
    {"capability_id": "policy.controlled-code-check", "version": "1.0.0"},
    {"capability_id": "workflow.code-quality", "version": "1.0.0"}
  ],
  "benchmark_suites": [],
  "conformance": [],
  "resources": []
}
