{"benchmark_suites":[{"suite_id":"example.suite","version":"1.0.0"}],"capabilities":[{"capability_id":"example.research","version":"1.0.0"}],"conformance":[{"media_type":"application/json","resource_id":"externalization.json","sha256":"516f209e7d4076b2897f2e5c282f709d7c31c7be334e2a80e2a7a6b82e3aecab"}],"package_id":"example.package","protocol":"asterion.capability-package/v1","resources":[{"media_type":"application/json","resource_id":"example.conformance","sha256":"0977396ff554935ae109aad975aa8d857b65a7fa55f0c52f2a579ffe8d1523f3"}],"version":"1.0.0"}
