{"benchmark_suites":[],"capabilities":[{"capability_id":"prime.arc-agi-3","version":"1.0.0"},{"capability_id":"prime.bounded-autonomy","version":"1.0.0"},{"capability_id":"prime.continual-improvement","version":"1.0.0"},{"capability_id":"prime.ipython-coding","version":"1.0.0"},{"capability_id":"prime.long-session-continuity","version":"1.0.0"},{"capability_id":"prime.programmatic-long-context","version":"1.0.0"},{"capability_id":"prime.recursive-workflow","version":"1.0.0"}],"conformance":[{"media_type":"application/json","resource_id":"externalization.json","sha256":"b0ccfd52a20fdf588b166c2b8c5138e78092c54b1b26caac3ec3162eeef39396"}],"package_id":"prime-agent","protocol":"asterion.capability-package/v1","resources":[{"media_type":"text/plain","resource_id":"prime-ipython-coding.fixture","sha256":"486a083f857430c7d6a452ebf881d1b8c46063c128b51162ffdebef0c1f71c7a"}],"version":"1.0.0"}
