{"benchmark_suites":[],"capabilities":[{"capability_id":"contoso.audit-record","version":"1.0.0"}],"conformance":[{"media_type":"application/json","resource_id":"externalization.json","sha256":"bb3c07840fba9a11eb328e4802c6782b24ecd1e096b8fa94d526025db1773c9b"}],"package_id":"contoso.audit","protocol":"asterion.capability-package/v1","resources":[{"media_type":"application/json","resource_id":"example.conformance","sha256":"4d3952f10c153960b52698c9d8bcabf478129396b911c4b77ea241d2c0bf6797"}],"version":"1.0.0"}
