{"benchmark_suites":[],"capabilities":[{"capability_id":"ecosystem.package.capability","version":"1.0.0"}],"conformance":[{"media_type":"application/json","resource_id":"package.json","sha256":"9e979a3f8c45391e357f1719276f20f550d8f86e0585af7715f2c92c884e3fa7"}],"package_id":"ecosystem.sample","protocol":"asterion.capability-package/v1","resources":[{"media_type":"application/json","resource_id":"data.json","sha256":"9efc3fd70de527d97755514d1313ab811fdf2bd9bb384afeb7d81a8dea2f723e"}],"version":"1.0.0"}
