{"benchmark_suites":[{"suite_id":"acme.suite","version":"1.0.0"}],"capabilities":[{"capability_id":"acme.research","version":"1.0.0"}],"conformance":[{"media_type":"application/json","resource_id":"externalization.json","sha256":"f1f023bfe5c59b020d0d9f2c43180a86b548e3b2134110fd146ec462f4ef05a1"}],"package_id":"acme.sample","protocol":"asterion.capability-package/v1","resources":[{"media_type":"application/json","resource_id":"example.conformance","sha256":"419af6061641af5b87099d9a9ab8a7f98033e1c2f0367bf16dcd4013afa7b169"}],"version":"1.0.0"}
