{
  "protocol": "asterion.capability-package/v1",
  "package_id": "dci",
  "version": "1.0.0",
  "capabilities": [
    {"capability_id": "dci.analysis", "version": "1.0.0"},
    {"capability_id": "dci.benchmark", "version": "1.0.0"},
    {"capability_id": "dci.evaluation", "version": "1.0.0"},
    {"capability_id": "dci.export", "version": "1.0.0"},
    {"capability_id": "dci.research", "version": "1.0.0"},
    {"capability_id": "policy.local-corpus", "version": "1.0.0"},
    {"capability_id": "protocol.observability", "version": "1.0.0"}
  ],
  "benchmark_suites": [],
  "conformance": [],
  "resources": []
}
